{
  "$schema": "https://json-schema.org/draft/2020-12/schema",
  "$id": "storymaker/canon@1",
  "title": "CTR-005 - Canon congelado (Etapa 2 -> Etapa 3)",
  "description": "Artefacto CONGELADO. Ni el Escritor ni el autor pueden alterarlo durante la Etapa 3: ante un conflicto se ajusta la escena al canon, no el canon a la escena (ERR-803, RF-024).",
  "type": "object",
  "required": ["esquema", "estado", "congelado_en", "personajes", "trama", "capitulos"],
  "properties": {
    "esquema": { "const": "canon@1" },
    "estado": { "enum": ["Propuesto", "Congelado"] },
    "congelado_en": { "type": "string", "format": "date-time" },
    "personajes": {
      "type": "array",
      "minItems": 1,
      "items": {
        "type": "object",
        "required": ["id", "nombre", "naturaleza", "rasgos", "motivacion", "presencia"],
        "properties": {
          "id": { "type": "string" },
          "nombre": { "type": "string" },
          "naturaleza": { "enum": ["Ficticio", "Real"] },
          "rasgos": { "type": "array", "items": { "type": "string" } },
          "motivacion": { "type": "string" },
          "presencia": {
            "type": "array",
            "description": "Puede ser vacia si solo_referido es true (RF-017, caso limite).",
            "items": {
              "type": "object",
              "required": ["escena", "lugar", "momento_narrativo"]
            }
          },
          "solo_referido": { "type": "boolean" },
          "afirmaciones_situantes": {
            "type": "array",
            "items": { "type": "string", "pattern": "^AF-[0-9]{4}$" },
            "description": "Obligatoria y no vacia si naturaleza = Real, salvo que sin_respaldo_declarado sea true (RNF-012)."
          },
          "sin_respaldo_declarado": { "type": "boolean" }
        }
      }
    },
    "trama": {
      "type": "object",
      "required": ["arco", "acontecimientos", "conflicto", "resolucion"],
      "properties": {
        "arco": { "type": "string" },
        "conflicto": { "type": "string" },
        "resolucion": { "type": "string" },
        "acontecimientos": {
          "type": "array",
          "items": {
            "type": "object",
            "required": ["id", "descripcion", "escenas"],
            "properties": {
              "escenas": { "type": "array", "minItems": 1, "description": "Todo acontecimiento se asigna a al menos una escena." }
            }
          }
        },
        "condensaciones": { "type": "array", "items": { "type": "string" }, "description": "Que se condenso al no caber en los capitulos disponibles (RF-018, escenario 2)." },
        "saltos_temporales_declarados": { "type": "array", "items": { "type": "string" }, "description": "Narracion no lineal deliberada. Sin declarar, el verificador la rechaza (RF-021, caso limite)." }
      }
    },
    "capitulos": {
      "type": "array",
      "minItems": 1,
      "items": {
        "type": "object",
        "required": ["orden", "titulo", "escenas"],
        "properties": {
          "orden": { "type": "integer", "minimum": 1 },
          "titulo": { "type": "string" },
          "escenas": {
            "type": "array",
            "minItems": 1,
            "items": {
              "type": "object",
              "required": ["orden", "sinopsis", "lugar", "momento_narrativo", "personajes"]
            }
          }
        }
      }
    },
    "licencias_literarias": {
      "type": "array",
      "items": {
        "type": "object",
        "required": ["id", "elemento_afectado", "desviacion", "justificacion"],
        "properties": {
          "personaje_ref": { "type": "string" },
          "afirmacion_ref": { "type": "string", "pattern": "^AF-[0-9]{4}$" }
        }
      },
      "description": "Los tres campos obligatorios son RF-019 y RNF-012. Una desviacion sobre Figura Real sin licencia es hallazgo de incoherencia historica."
    },
    "cliches_deliberados": {
      "type": "array",
      "items": { "type": "object", "required": ["entrada_cliche", "justificacion"] },
      "description": "Un cliche declarado aqui se admite y no genera hallazgo (RF-022, caso limite)."
    },
    "conflictos_encargo_contexto": {
      "type": "array",
      "items": { "type": "object", "required": ["descripcion", "resolucion"] },
      "description": "RF-016, escenario 2: el conflicto entre lo que pide el Encargo y lo que dice el Contexto se declara, NUNCA se resuelve en silencio (ERR-801)."
    },
    "elementos_no_respaldados": {
      "type": "array",
      "items": { "type": "object", "required": ["elemento", "motivo"] },
      "description": "Elementos sobre los que el Contexto no dice nada. No son motivo de rechazo: se registran (RF-020, caso limite)."
    }
  },
  "invariantes_al_congelar": {
    "_comprueba": "CMP-009",
    "lista": [
      "El numero de capitulos es igual a parametros.capitulos del Encargo.",
      "El orden de los capitulos es contiguo desde 1.",
      "El numero de escenas de cada capitulo es igual a parametros.parrafos_por_capitulo.",
      "Todo acontecimiento de la trama esta asignado a al menos una escena.",
      "Toda desviacion conocida sobre una Figura Real esta cubierta por una licencia declarada (RNF-012).",
      "Ningun personaje aparece en dos escenas del mismo momento narrativo en lugares distintos.",
      "No hay referencias rotas: toda escena, personaje y acontecimiento citado existe.",
      "Todo personaje de naturaleza Real tiene afirmaciones_situantes no vacias o sin_respaldo_declarado en true."
    ]
  }
}
