{
  "esquema": "canon@1",
  "estado": "Propuesto",
  "congelado_en": "2026-09-18T14:00:00Z",
  "personajes": [
    {
      "id": "PJ-01",
      "nombre": "Rodrigo de Castroverde",
      "naturaleza": "Ficticio",
      "rasgos": ["Honorable", "Conflictuado", "Perceptivo"],
      "motivacion": "Mantener su honor frente a la lealtad dividida entre Castilla y León",
      "presencia": [
        { "escena": "CAP-01/ESC-01", "lugar": "Campamento de asedio", "momento_narrativo": "Fase inicial del asedio" },
        { "escena": "CAP-01/ESC-02", "lugar": "Tiendas de guerra", "momento_narrativo": "Fase inicial del asedio" },
        { "escena": "CAP-01/ESC-03", "lugar": "Tiendas de guerra", "momento_narrativo": "Fase inicial del asedio" },
        { "escena": "CAP-01/ESC-04", "lugar": "Campamento de asedio", "momento_narrativo": "Fase inicial del asedio" },
        { "escena": "CAP-02/ESC-01", "lugar": "Pabellón regio", "momento_narrativo": "El asedio prolongado" },
        { "escena": "CAP-02/ESC-02", "lugar": "Murallas de Zamora", "momento_narrativo": "El asedio prolongado" },
        { "escena": "CAP-02/ESC-03", "lugar": "Campamento de asedio", "momento_narrativo": "El asedio prolongado" },
        { "escena": "CAP-02/ESC-04", "lugar": "Capilla del campamento", "momento_narrativo": "El asedio prolongado" },
        { "escena": "CAP-03/ESC-01", "lugar": "Campamento de asedio", "momento_narrativo": "El colapso del cerco" },
        { "escena": "CAP-03/ESC-02", "lugar": "Tiendas privadas", "momento_narrativo": "El colapso del cerco" },
        { "escena": "CAP-03/ESC-03", "lugar": "Pabellón de Sancho II", "momento_narrativo": "El colapso del cerco" },
        { "escena": "CAP-03/ESC-04", "lugar": "Campamento de asedio", "momento_narrativo": "El colapso del cerco" }
      ]
    },
    {
      "id": "PJ-02",
      "nombre": "Sancho II",
      "naturaleza": "Real",
      "rasgos": ["Determinado", "Ambicioso", "Imperioso"],
      "motivacion": "Reunificar los reinos bajo su corona",
      "presencia": [
        { "escena": "CAP-01/ESC-01", "lugar": "Campamento de asedio", "momento_narrativo": "Fase inicial del asedio" },
        { "escena": "CAP-02/ESC-03", "lugar": "Campamento de asedio", "momento_narrativo": "El asedio prolongado" },
        { "escena": "CAP-03/ESC-01", "lugar": "Campamento de asedio", "momento_narrativo": "El colapso del cerco" },
        { "escena": "CAP-03/ESC-02", "lugar": "Pabellón regio", "momento_narrativo": "El colapso del cerco" },
        { "escena": "CAP-03/ESC-03", "lugar": "Pabellón de Sancho II", "momento_narrativo": "El colapso del cerco" }
      ],
      "afirmaciones_situantes": ["AF-0020", "AF-0018", "AF-0019", "AF-0048", "AF-0047", "AF-0002"]
    },
    {
      "id": "PJ-03",
      "nombre": "Doña Urraca",
      "naturaleza": "Real",
      "rasgos": ["Estoica", "Valiente", "Leal al derecho leonés"],
      "motivacion": "Defender Zamora y la legitimidad del reino de León",
      "presencia": [
        { "escena": "CAP-01/ESC-02", "lugar": "Interior de Zamora", "momento_narrativo": "Fase inicial del asedio" },
        { "escena": "CAP-02/ESC-02", "lugar": "Murallas de Zamora", "momento_narrativo": "El asedio prolongado" }
      ],
      "afirmaciones_situantes": ["AF-0021", "AF-0018"]
    },
    {
      "id": "PJ-04",
      "nombre": "Bellido Dolfos",
      "naturaleza": "Real",
      "rasgos": ["Enigmático", "Resuelto", "Alevoso"],
      "motivacion": "Cambiar el curso de la contienda mediante la eliminación del rey",
      "presencia": [
        { "escena": "CAP-01/ESC-04", "lugar": "Campamento de asedio", "momento_narrativo": "Fase inicial del asedio" },
        { "escena": "CAP-02/ESC-03", "lugar": "Campamento de asedio", "momento_narrativo": "El asedio prolongado" },
        { "escena": "CAP-03/ESC-02", "lugar": "Tiendas privadas", "momento_narrativo": "El colapso del cerco" },
        { "escena": "CAP-03/ESC-03", "lugar": "Pabellón de Sancho II", "momento_narrativo": "El colapso del cerco" }
      ],
      "afirmaciones_situantes": ["AF-0002"]
    }
  ],
  "trama": {
    "arco": "Un infanzón dividido entre la lealtad feudal a Sancho II y su sangre leonesa descubre que el asesinato del rey es inevitable y debe elegir qué honor es mayor.",
    "conflicto": "Rodrigo de Castroverde está atrapado entre el juramento de vasallaje a Sancho II y las raíces familiares que lo atan a León, mientras el rey asedia la ciudad gobernada por su tía.",
    "resolucion": "Bellido Dolfos asesina a Sancho II el 7 de octubre de 1072, terminando el asedio. Rodrigo permanece testigo mudo, liberado de un conflicto imposible pero marcado para siempre por la verdad que no puede revelar.",
    "acontecimientos": [
      {
        "id": "AC-01",
        "descripcion": "La división de los reinos entre los hijos de Fernando I crea un conflicto dinástico que enfrenta el derecho de sucesión de los herederos.",
        "escenas": ["CAP-01/ESC-02", "CAP-01/ESC-03", "CAP-02/ESC-04"]
      },
      {
        "id": "AC-02",
        "descripcion": "Rodrigo es designado emisario entre el campamento y la ciudad, exponiéndose a los conflictos de lealtad de ambos bandos.",
        "escenas": ["CAP-02/ESC-01", "CAP-02/ESC-02"]
      },
      {
        "id": "AC-03",
        "descripcion": "Bellido Dolfos gana la confianza de Sancho II, acercándose al rey y estableciendo el camino que conduce al asesinato.",
        "escenas": ["CAP-01/ESC-04", "CAP-02/ESC-03", "CAP-03/ESC-02"]
      },
      {
        "id": "AC-04",
        "descripcion": "El asesinato de Sancho II en el campamento resuelve el cerco y libera a Rodrigo del conflicto irresuelto de sus lealtades.",
        "escenas": ["CAP-03/ESC-03", "CAP-03/ESC-04"]
      }
    ],
    "condensaciones": [],
    "saltos_temporales_declarados": []
  },
  "capitulos": [
    {
      "orden": 1,
      "titulo": "La Sangre Dividida",
      "escenas": [
        {
          "orden": 1,
          "sinopsis": "En el campamento de asedio a Zamora, el infanzón Rodrigo de Castroverde observa a Sancho II mientras planifica la ofensiva final. El rey, reunificador de Castilla, León y Galicia, está decidido a reducir esta última plaza rebelde. Rodrigo ha jurado vasallaje a Sancho II. Ahora su feudo sufre el cerco.",
          "lugar": "Campamento de asedio",
          "momento_narrativo": "Fase inicial del asedio",
          "personajes": ["PJ-01", "PJ-02"]
        },
        {
          "orden": 2,
          "sinopsis": "Llega noticia de Zamora: la infanta Urraca, tía de la madre de Rodrigo, lidera la resistencia con apoyo de nobles leoneses. Su sangre se divide entre Castilla y León. El juramento que prestó a Sancho compite con el honor de su linaje materno. La lealtad se quiebra en su pecho.",
          "lugar": "Tiendas de guerra",
          "momento_narrativo": "Fase inicial del asedio",
          "personajes": ["PJ-01", "PJ-03"]
        },
        {
          "orden": 3,
          "sinopsis": "En las tiendas de guerra, otros infanzones dudan de la justicia del asedio. Rodrigo escucha mencionar la ley visigoda que prohíbe dividir reinos. ¿Acaso Sancho no viola esa ley al conquistar lo de sus hermanos? ¿Lucha por un rey legítimo o es complicidad en alevosía contra la ley?",
          "lugar": "Tiendas de guerra",
          "momento_narrativo": "Fase inicial del asedio",
          "personajes": ["PJ-01"]
        },
        {
          "orden": 4,
          "sinopsis": "Bellido Dolfos llega al campamento como caballero en busca de servicio. Rodrigo lo observa con inquietud: hay algo oscuro en su cortesía. Dolfos se acerca a Sancho II con familiaridad de íntimo. Un presentimiento atraviesa a Rodrigo sin razón clara. Presiente algo sin poder nombrarlo.",
          "lugar": "Campamento de asedio",
          "momento_narrativo": "Fase inicial del asedio",
          "personajes": ["PJ-01", "PJ-04", "PJ-02"]
        }
      ]
    },
    {
      "orden": 2,
      "titulo": "El Filo del Honor",
      "escenas": [
        {
          "orden": 1,
          "sinopsis": "Sancho II designa a Rodrigo emisario en un intento de parlamento. Su conocimiento de los lazos leoneses lo hace útil, pero la ironía duele. ¿Negociará la rendición de su tía? ¿Traiciona a su rey si fracasa? El honor brinda temblando en sus manos.",
          "lugar": "Pabellón regio",
          "momento_narrativo": "El asedio prolongado",
          "personajes": ["PJ-01", "PJ-02"]
        },
        {
          "orden": 2,
          "sinopsis": "Dentro de Zamora, Rodrigo ve a Urraca en los muros. Su dignidad es inquebrantable bajo el cerco. La ciudad sufre hambre, pero no se rinde. En su rostro, Rodrigo reconoce el honor de su linaje materno. La compasión choca contra el deber frío. Esa noche no duerme.",
          "lugar": "Murallas de Zamora",
          "momento_narrativo": "El asedio prolongado",
          "personajes": ["PJ-01", "PJ-03"]
        },
        {
          "orden": 3,
          "sinopsis": "Bellido Dolfos ha ganado confianza. Sancho II lo mantiene cerca en consultas de guerra. Rodrigo lo observa rondando los aposentos reales, susurrante. Dolfos mira a Rodrigo con conocimiento incómodo, como si reconociera en él la misma grieta moral. Los dos cargan un secreto sin palabras.",
          "lugar": "Campamento de asedio",
          "momento_narrativo": "El asedio prolongado",
          "personajes": ["PJ-01", "PJ-04", "PJ-02"]
        },
        {
          "orden": 4,
          "sinopsis": "Un sacerdote del acompañamiento confía a Rodrigo dudas sobre la justicia de la guerra. ¿Es lícito que Sancho tome lo que sus hermanos heredaron? La ley divina no está clara. La ley del hombre tampoco. Rodrigo sale de la confesión más perdido que cuando entró.",
          "lugar": "Capilla del campamento",
          "momento_narrativo": "El asedio prolongado",
          "personajes": ["PJ-01"]
        }
      ]
    },
    {
      "orden": 3,
      "titulo": "La Caída del Rey",
      "escenas": [
        {
          "orden": 1,